<?xml version="1.0" encoding="ISO-8859-1"?>
<!DOCTYPE animator SYSTEM "../dtd/animator.dtd">

<animator>

	<name>triangle</name>
	<keys>
		<key>
			<duration>60</duration>
			<tweenMode>TWEENING</tweenMode>
			<easeMode>EASEINQUAD</easeMode>
			<oscillator>none</oscillator>
			<scaleX>1</scaleX>
			<scaleY>1</scaleY>
			<rotationAngle>0</rotationAngle>
			<rotationOffset>0</rotationOffset>
			<transX>-3</transX>
			<transY>3</transY>
			<renderer>F_blue_255</renderer>
		</key>
		<key>
			<duration>60</duration>
			<tweenMode>TWEENING</tweenMode>
			<easeMode>EASEINQUAD</easeMode>
			<oscillator>none</oscillator>
			<scaleX>1</scaleX>
			<scaleY>1</scaleY>
			<rotationAngle>0</rotationAngle>
			<rotationOffset>0</rotationOffset>
			<transX>0</transX>
			<transY>-3</transY>
			<renderer>F_blue_255</renderer>
		</key>
		<key>
			<duration>60</duration>
			<tweenMode>TWEENING</tweenMode>
			<easeMode>EASEINQUAD</easeMode>
			<oscillator>none</oscillator>
			<scaleX>1</scaleX>
			<scaleY>1</scaleY>
			<rotationAngle>0</rotationAngle>
			<rotationOffset>0</rotationOffset>
			<transX>3</transX>
			<transY>3</transY>
			<renderer>F_blue_255</renderer>
		</key>
	</keys>

</animator>
