<?xml version="1.0" encoding="ISO-8859-1"?>
<!DOCTYPE animator SYSTEM "../dtd/animator.dtd">
<animator>
    <name>flip_left_right</name>
    <keys>
        <key>
            <duration>30.0</duration>
            <tweenMode>TWEENING</tweenMode>
            <easeMode>easeInQuint</easeMode>
            <oscillator>none</oscillator>
            <scaleX>1.0</scaleX>
            <scaleY>1.0</scaleY>
            <rotationAngle>0.0</rotationAngle>
            <rotationOffset>0.0</rotationOffset>
            <transX>0.0</transX>
            <transY>0.0</transY>
            <renderer>F_blue_255</renderer>
        </key>
        <key>
            <duration>30.0</duration>
            <tweenMode>TWEENING</tweenMode>
            <easeMode>linear</easeMode>
            <oscillator>none</oscillator>
            <scaleX>0.0</scaleX>
            <scaleY>0.6</scaleY>
            <rotationAngle>0.0</rotationAngle>
            <rotationOffset>0.0</rotationOffset>
            <transX>0.0</transX>
            <transY>0.0</transY>
            <renderer>F_blue_255</renderer>
        </key>
        <key>
            <duration>30.0</duration>
            <tweenMode>TWEENING</tweenMode>
            <easeMode>easeInQuint</easeMode>
            <oscillator>none</oscillator>
            <scaleX>-1.0</scaleX>
            <scaleY>1.0</scaleY>
            <rotationAngle>0.0</rotationAngle>
            <rotationOffset>0.0</rotationOffset>
            <transX>0.0</transX>
            <transY>0.0</transY>
            <renderer>F_blue_255</renderer>
        </key>
        <key>
            <duration>30.0</duration>
            <tweenMode>TWEENING</tweenMode>
            <easeMode>linear</easeMode>
            <oscillator>none</oscillator>
            <scaleX>0.0</scaleX>
            <scaleY>0.6</scaleY>
            <rotationAngle>0.0</rotationAngle>
            <rotationOffset>0.0</rotationOffset>
            <transX>0.0</transX>
            <transY>0.0</transY>
            <renderer>F_blue_255</renderer>
        </key>
    </keys>
</animator>
